{
  "id": "mem_payment_idempotency_retry_001",
  "title": "支付重试前先落实幂等保护",
  "recall_hint": "当任务涉及有副作用的重试写入时，优先检查幂等键、唯一约束和重复请求返回策略。",
  "content": "适用于支付、库存、订单等存在副作用的重试场景。优先确认入口是否传递幂等键，存储层是否具备唯一约束，以及重复请求是否返回首次结果而不是再次执行。常见风险是网络抖动或客户端重试导致重复扣款、重复写入或重复发货。",
  "status": "active",
  "expire_at": "2026-10-10"
}
